created_at,verified,favorite_count,retweet_count,twitter_engagement,clean_text,topic,topic_revised,topic_final
2020-02-04T01:51:21Z,FALSE,904,824,1728,"#HongKong medical staff strike for closure of #China border, as #coronavirus continues to be a threat to Hong Kong.",,,
2020-02-02T22:58:17Z,FALSE,889,835,1724,"Chinese police knock on the door of the houses where there are people who share news on social networks about the expansion of the coronavirus in China. ""The first is a warning, the second is jail time"" says the agent. #Coronavirus, #China, #FreeSpeech",,,
2020-01-31T09:20:01Z,TRUE,1328,395,1723,"A foreign blogger welcomed foreigners to join her video campaign to say ""China, jiayou!"" meaning ""Stay strong, China."" to support China in fighting the #coronavirus outbreak.",,,
2020-02-02T00:19:37Z,TRUE,1115,608,1723,BREAKING: Latest update on #CoronaVirus - 14 550 confirmed cases. - 304 dead. - 328 recovered. - 19 554 suspected cases. - 24 countries affected. This appears to be spreading rapidly now,,,
2020-01-25T20:23:50Z,TRUE,1381,341,1722,"For #Wuhan, not realistic to do crypto to end beneficiaries. Binance pledged 10m RMB ($1.5m USD) to help #coronavirus victims. We didnt make any announcements. But BCF/Binance team has been busy for the last few days. Still need help to arrange logistics locally.",,,
2020-01-29T16:13:47Z,TRUE,1114,605,1719,"JUST IN: Flight from Wuhan, China, has landed at March Air Reserve Base in Riverside 200+ American citizens onboard will be quarantined for 72 hours and screened for #coronavirus symptoms. #abc7eyewitness @ABC7",,,
2020-02-02T06:55:23Z,TRUE,1441,275,1716,Chinese Embassy lauds Pakistani doctor for joining fight against #coronavirus See report from Geo TV :,,,
2020-01-31T15:46:06Z,TRUE,938,764,1702,"THREAD Almost 10,000 people have been infected by the #coronavirus. It spreads like other respiratory illnesses such as the flu. Here's what you need to know",,,
2020-02-06T01:03:39Z,FALSE,1045,654,1699,"This is how CCP is monitoring WeChat and other channels. So much surveillance in China due to censorship. If only Chinese thought police put all this energy into something more useful, like maybe combating #coronavirus outbreak. (Posted by Robin 3).",,,
2020-02-06T13:36:08Z,TRUE,996,701,1697,You've all heard about the #coronavirus - but what do we really know about it? #AJStartHere explains,,,
2020-01-31T10:33:55Z,FALSE,913,783,1696,Medical workers in #HongKong are planning a strike in the coming days to demand the HK Govt to close off all borders to stop influx of Chinese tourists that may carry deadly #coronavirus to HK and putting a strain on HK society. We fully support their actions #StandwithHK,,,
2020-02-10T20:10:46Z,TRUE,999,694,1693,"There are concerns about the global spread of #coronavirus, with a new map showing the predicted movements of 60,000 Wuhan residents who fled the Chinese city before it was placed into lockdown.",,,
2020-01-31T14:57:22Z,FALSE,1340,352,1692,Some Facts To Calm You: 1. Mortality rate of #CoronaVirus is 2%. Meaning for every 100 people infected only 2 can die 2. Mortality rate of #CommonFlu is 1% 3. Mortality rate of #SARS virus of 2003 was 9.6%. 500 times more than Corona. But 2003 had no #Twitter to create panic,,,
2020-01-29T15:38:39Z,TRUE,1003,677,1680,BREAKING: German airline Lufthansa has cancelled all flights to and from China due to the #coronavirus. More to follow at,,,
2020-01-31T09:42:34Z,FALSE,1378,302,1680,UK complete the double signing of #coronavirus from China on a long term deal. More to follow. #DeadlineDay,,,
2020-02-10T17:25:43Z,TRUE,1279,398,1677,Having reached the end of my two week #coronavirus quarantine period its amazing to go out onto the streets of Beijing and see it heaving with millions of people not afraid of contamination. #China,,,
2020-02-02T02:42:43Z,FALSE,1137,539,1676,Has anyone confirmed what they are spraying? Antidote? Virus? Disinfectant? What's the chemical make up? How did china have so much of this ready to go with equipment? What isnt china sharing? Any feed back or thoughts??? #coronavirus #CoronaVirusCanada,,,
2020-01-27T15:22:05Z,TRUE,1139,533,1672,First #CoronaVirus infected patient found in Sri Lanka. Reportedly a Chinese woman. Health Promotion Bureau requests people not to panic as action currently being taken to control the virus from spreading,,,
2020-01-31T15:53:25Z,FALSE,811,860,1671,More shocking evidence of people in the #Hubei province dropping down onto the floor of being very ill of the #CoronaVirus in #China.,,,
2020-01-27T02:48:54Z,FALSE,1029,636,1665,If this model still holds true in 5 days we are in trouble. #coronavirus,,,
2020-02-02T06:13:22Z,TRUE,848,810,1658,"Even though frontline nurses and doctors are ready to sit and talk, the unpopular pro-#Beijing city leader #Carrielam just canceled the meeting and refuses to negotiate with the frontline medical staff. #coronavirus",,,
2020-02-10T03:21:02Z,FALSE,859,795,1654,#H5N1 and #AfricanSwineFlu have decimated China's food industry and now people are desperate. Some are even willing to risk it all for rice #coronavirus #CoronavirusOutbreak #Wuhan #coronaviruschina #coronavirusaustralia #CoronaVirusCanada,,,
2020-02-06T22:19:15Z,FALSE,812,838,1650,"Confirmed #coronavirus cases by country: 29,805 633 dead 45 30 25 24 1 dead 23 16 15 14 13 12 12 10 6 5 5 3 1 dead 3 3 2 2 1 1 1 1 1 1 1 TOTAL Infected: 30,811 Deaths: 635 Map:",,,
2020-02-04T01:46:24Z,FALSE,881,765,1646,"2/3 #coronavirus Surveillance camera captured a security guard who suddenly fell from seat, twitched for half minute and finally stopped the movement. This is the video circulating in social media today. This video coincided with those that suddenly died while walking.",,,
2020-02-10T01:02:58Z,TRUE,846,800,1646,video shows personal belongings left by students in winter holiday just got thrown out of window .... this is because Chinese gov wants to turn students apartments into quarantine space for #coronavirus patients. no dignity for people in China #Wuhan,,,
2020-01-31T13:31:51Z,TRUE,1209,425,1634,"Twenty recovered #coronavirus patients, aged 15 to 65, were discharged from the Wuhan Jinyintan Hospital on Friday. They represent the largest number of people discharged at the same time since the outbreak began.",,,
2020-02-08T12:10:58Z,TRUE,941,691,1632,My cartoon Saturday @TheTimes on #Chinese suppression of #Coronavirus information. #DrLiWenliang #PresidentXi,,,
2020-01-25T09:54:27Z,FALSE,929,700,1629,UPDATE Countries with confirmed and suspected cases of Wuhan #Coronavirus.,,,situation_update
2020-02-10T20:26:53Z,FALSE,990,637,1627,The #Shanghai government just announced some terrible news The #Coronavirus IS airborne. It can be spread through the air EVEN if the infected person isn't present. Previously many doctors advice was to maintain a 1-2m distance and not wear a mask. This advice is now useless!,,,
2020-02-12T00:17:32Z,FALSE,904,719,1623,"This lady had contracted coronavirus and fell to the ground, the brave police and civilian clothes police can help her up to peacefully volunteer for quarantine. #coronavirus #CoronavirusOutbreak #Wuhan #coronaviruschina #coronavirusaustralia #CoronaVirusCanada",,,
2020-02-04T12:44:21Z,TRUE,1436,185,1621,"Indian Army: The five individuals who were isolated at the quarantine camp in Manesar, Haryana as they were showing symptoms of cough and cold, have been tested negative for #CoronaVirus.",,,
2020-01-25T04:27:26Z,FALSE,829,785,1614,"New voicemail from Chinese doctor working in quarantine zone: There are more than 100,000 infected, the government not providing medical supplies. People are dying in front of their eyes. Thanks to these brave souls for informing the world! #coronavirus",,,
2020-02-10T13:44:33Z,TRUE,1247,367,1614,Nothing can stop them from dancing! Optimistic patients with mild symptoms caused by the #coronavirus dance at a temporary hospital in Wuhan,,,
2020-02-08T07:55:14Z,TRUE,804,808,1612,"Breaking - Medical experts in Shanghai said earlier that they can now confirm the #coronaviruss main transmission route is through aerosol transmission and contacts. Direct transmission of the virus means that when a infected patient sneezes, coughs or exhales droplets ...",,,
2020-02-08T12:53:10Z,TRUE,1222,387,1609,In China it is suggested not to touch a door knob or elevator buttons . Solution for the elevator #coronavirus,,,
2020-02-04T02:44:45Z,TRUE,1520,81,1601,Just filmed an update to the #coronavirus situation. Will be live Wednesday 5pm EST!,,,
2020-01-27T18:01:21Z,FALSE,1047,547,1594,8) Overwhelming #coronavirus data suggests: A- High R0 between 2.6-2.9 (best sources). B- Has higher pandemic risk than SARS. C- Contagious even w/out symptoms (unlike SARS). D- Cases increasing rapidly overseas. E- Countries need time to prepare. @WHO needs to declare now!,,,
2020-02-12T09:07:22Z,TRUE,868,723,1591,"With the numbers of people infected with #coronavirus increasing, Professor Neil Ferguson - director of the @MRC_Outbreak at @imperialcollege tells #r4today he feels were in the early phases of a global pandemic Read more:",,,
2020-02-04T13:54:24Z,TRUE,1167,418,1585,"As the #Coronavirus continues to spread, the United States should quickly impose travel restrictions into our country from the affected region.",,,
2020-01-29T03:29:51Z,FALSE,1066,511,1577,Why the heck would she not fully close the border with China until they get on top of the #Coronavirus?! Because shes putting the CCP before Hong Kong. Shame on her.,,,personal_opinion
2020-02-12T09:36:29Z,FALSE,1083,493,1576,This happened. Doctors from #Xinjiang dancing in a #coronavirus hospital.,,,
2020-02-06T11:35:12Z,FALSE,1126,443,1569,Use everything to your advantage ;) #coronavirus,,,
2020-01-29T00:14:51Z,TRUE,1326,242,1568,Stockpiling medical supplies to support #Wuhan people! @Tronfoundation is doing everything we can to fight #coronavirus! Join us! #TRON,,,
2020-01-25T11:31:03Z,FALSE,807,757,1564,UPDATE: Transmissibility estimates of #coronavirus #2019nCoV at 2.6 Identification testing potential cases to be as extensive as permitted by healthcare testing capacity @neil_ferguson @dr_anne_cori @SRileyIDD @MarcBaguelin @IlariaDorigatti,,,
2020-02-08T21:33:23Z,FALSE,811,750,1561,"People inside this apartment building are being quarantined due to #coronavirus. A worker welds exit doors shut, so they dont escape from the building.",,,
2020-01-27T02:37:00Z,TRUE,781,775,1556,"CDC confirms 3 new cases of novel #coronavirus (#2019nCoV) infection in the U.S., 1 in AZ 2 in CA, bringing total to 5. All US cases travelled from Wuhan, China. More cases may be identified. However, risk to US general public is still considered low.",,,
2020-02-02T12:36:27Z,TRUE,1346,206,1552,"Total 300 people reached this forenoon to Chhawla facility of ITBP. Todays arrival also includes 7 persons from Maldives. With this, the total number of persons taken from #China to ITBP Center stands 404. All possible care being extended. #Wuhan #CORONAVIRUS #Himveers",,,
2020-01-29T13:21:27Z,FALSE,900,651,1551,"5 things helpers 2 win the fight 4LegCo in Sept: @hkpoliceforce brutality, Commissar Lamb's stupidity on NOT closing the border 2 protecters, birth of newunions,needs$ center due 2 GDP likely at &lt;5%, #coronavirus is Emperor Shithole's Chernobyl. The bully's weakened.",,,
2020-01-31T17:37:49Z,FALSE,1211,334,1545,BREAKING: Delta Air Lines and American Airlines are suspending all flights between the U.S. and China amid #coronavirus outbreak.,,,
2020-02-02T16:50:00Z,FALSE,820,725,1545,No one can disembark from Hokkaido flying to Hong Kong. Seven people had a fever. It is believed that Hong Kong aircraft were banned from entering the world soon. No news reported yet #coronavirus,,,
2020-02-04T00:42:26Z,TRUE,1027,514,1541,The #coronavirus has now killed more mainland Chinese than SARS. This is just the confirmed death toll. The Caijing article gave evidence of significant underreporting and underdiagnosis. And disease is unfortunately not yet at its peak.,,,
2020-01-31T14:49:14Z,TRUE,1074,466,1540,"Last week, I asked federal health security officials about travel to from #China given #coronavirus. With worsening conditions since then, its time to consider restricting all US commercial travel to and from China. Public health must be paramount",,,
2020-02-06T14:25:32Z,FALSE,1023,517,1540,"We've reached a point where people are starting to wear inflatable costumes on the streets to protect themselves against the #coronavirus. According to Chinese media, a medical expert said this is ""unnecessary"" and that washing hands and wearing face masks will do",,,
2020-02-02T12:31:32Z,TRUE,1416,121,1537,Make fun all you want I aint getting no #coronavirus,,,
2020-01-27T20:28:46Z,TRUE,1260,275,1535,"Be paranoid but not hysterical, is my approach to #coronavirus. Yes its possible to ride this line. Freaking out isnt helpful but we need to close the borders to be precautious.",,,
2020-01-25T11:38:40Z,FALSE,702,826,1528,"Know thy enemy. In 1918, H1N1 influenza virus reduced Earth population by 50-100 million. It revisited us 10 years ago left with 284,500 lives. Remember swine flu? Yup same guy. The Wuhan virus belong to #Coronavirus, the crime family that causes MERS-CoV SARS.",,,
2020-02-02T21:21:20Z,FALSE,976,552,1528,Update: Thai medics claim #coronavirus break-through: Patient is declared 'disease-free' in 48 hours. Doctors in Thailand mixed antiviral drugs used for influenza and HIV and found it worked effectively and improved the patients condition quickly.,,,
2020-02-12T13:05:00Z,FALSE,854,667,1521,"The last video of Bin Fang who exposed the truth of #coronavirus, before he was captured by the Chinese Communist Party. The western and US,please save Bin from CCPs persecution retweet and let more people know.",,,
2020-02-02T16:53:07Z,TRUE,884,635,1519,"The Chinese embassy to Israel called the decision to close Israel's borders to visitors from #China due to the spread of the #coronavirus ""reminiscent of the #Holocaust,"" stressing that China kept its borders open to Jews during World War II.",,,
2020-01-31T13:00:09Z,FALSE,932,583,1515,"Yep, that's the answer to #Coronavirus crisis: bullying grannies with drones.",,,
2020-02-06T22:12:45Z,FALSE,920,595,1515,"Chinese doctor Li Wenliang # who 1st sounded alarm about #coronavirus in Wuhan on Dec 30th and was arrested by Wuhan police for spreading rumor, died from #WuhanCoronavirus. He was cleared by Chinese Peoples Supreme Court recently. Chinese social media on now. Thread:",,,
2020-02-08T19:29:55Z,TRUE,899,616,1515,Chinese Citizen Journalist Disappears In #China: @GordonGChang Warns of #Coronavirus Origin,,,
2020-01-29T01:19:33Z,FALSE,1017,497,1514,"I again reiterated on air (for 5th time) for our demand for @WHO to declare a global emergency for #coronaviruss potential of pandemic, on @CBCNews @PnPCBC. I also maybe fact-checked Canadian health ministers incorrect claim that nCov cant spread before symptoms. It can!",,,
2020-02-02T15:51:29Z,TRUE,1044,465,1509,"In just 10 days! China builds new hospital to combat #coronavirus. With capacity of 1,000 beds, Huoshenshan hospital will bring hope to patients",,,
2020-01-31T12:50:11Z,TRUE,781,717,1498,"All the worst aspects of the Chinese Communist Party exacerbate the threats from the #coronavirus: the Partys dishonesty, corruption, and insistence on face-saving...",,,
2020-01-31T13:14:36Z,TRUE,1259,236,1495,"Stop what you're doing right now and listen to Luke, the hilarious caller currently stranded in China due to coronavirus. @mrjamesob | #Coronavirus",,,
2020-02-04T22:01:37Z,FALSE,913,582,1495,Just a Common Flu patrol. #coronavirus,,,
2020-01-29T00:24:59Z,TRUE,939,555,1494,Two people suspected of having #coronavirus hospitalised in Russia,,,
2020-02-08T07:42:28Z,FALSE,959,534,1493,Something tells me the Chinese government isn't being fully transparent about WHAT THE FUCK IS REALLY GOING ON OVER THERE???!!! #coronavirus,,,
2020-02-02T07:58:24Z,FALSE,1122,370,1492,"A 9-year-old girl brings dumplings to her nurse mother, who has been fighting frontline against the #coronavirus .. HEART-BREAKING..!! Real heroes at duty.. #Master",,,
2020-01-29T13:36:58Z,FALSE,1071,419,1490,"BREAKING: An old, yet always evolving, type of virus is already infecting thousands of in the Philippines amidst the international outbreak of novel #coronavirus! It's called #ChismisnaVirus (a.k.a. Fake News). Here are some prevention guidelines from the Earth Shaker Team. :)",,,
2020-02-08T18:04:21Z,TRUE,1154,334,1488,"#Coronavirus: Foreigners who went to China after January 15 not allowed to enter India, says DGCA",,,
2020-02-04T20:51:16Z,FALSE,733,754,1487,This video may have started to get removed from the internet. Keep this one alive. #coronavirus #wuhan #coronavirusoutbreak,,,
2020-01-29T05:57:46Z,FALSE,512,973,1485,Better safe than sorry. #coronavirus #2019,,,
2020-02-06T21:30:59Z,FALSE,641,840,1481,Deplorable conditions in Chinese hospitals as #Wuhans people battle the #Coronavirus outbreak under a communist system of GOVERNMENT RUN HEALTHCARE-ya know-the kind American Socialists want to impose upon us with #MedicareForAll #NeverSocialism,,,
2020-02-08T09:42:24Z,TRUE,841,637,1478,"Symptoms of Novel #Coronavirus 1. Systemic - fever, fatigue 2. Kidneys - decreased function 3. Intestines - diarrhea 4. Respiratory - runny nose, sore throat, shortness of breath, sneezing, dry cough 5. Circulatory - leucopenia COMPLICATIONS! * Pneumonia * Kidney failure",,,
2020-01-29T18:04:20Z,TRUE,999,478,1477,"We want to help you access credible information, especially when it comes to public health. Weve adjusted our search prompt in key countries across the globe to feature authoritative health sources when you search for terms related to novel #coronavirus.",,,
2020-02-04T23:50:34Z,FALSE,765,711,1476,2/4 #coronavirus Another case of sudden coma or death on the street of Hong Kong. So far what we have known about 19-nCov: - it is a lab made virus - with 4 inserted HIV gene - many sudden deaths - no obvious symptoms - possible release from CCP Location: Wengui St HK,,,
2020-01-29T19:34:09Z,FALSE,1157,318,1475,"This man deserves our endless respect Dr. Liang Wudong, who was treating patients of corona virus in wuhan, china,gets infected while treating patients and become the first doctor to die from the new #Coronavirus. A reminder that while everyone else is trying to avoid it,fron",,,
2020-01-29T14:34:38Z,TRUE,964,510,1474,"UPDATE on #coronavirus testing in the UK: As of 2pm on Wednesday 29 January 2020, a total of 130 tests have concluded: 130 were confirmed negative 0 positive Updates will be published at 2pm daily until further notice.",,,
2020-01-25T21:41:26Z,FALSE,822,649,1471,This photo was sent to me a few hours ago by someone I know of in #Wuhan. Theyve havent (yet!) got #coronavirus and they tried to leave the city to take their family to safety. Every road out was blocked. This sort of shit puts all my complaints into perspective,,,
2020-02-04T01:32:28Z,TRUE,775,695,1470,"#Coronavirus: Queues form at a pharmacy for face masks as a city-wide shortage continues. Nearby, a pack of 50 masks is selling for HK$380.",,,
2020-01-29T23:11:55Z,TRUE,1093,376,1469,"After recovering from the novel #coronavirus pneumonia, Guo Qin, a 38-year-old nurse in Wuhan returned to work to continue the fight against the virus. I dont want to be a hero, but I just cant run away at this time, she said. #URHero",,,
2020-01-31T21:53:08Z,TRUE,1052,411,1463,Senate impeachment abuse also must be shut down so Senate and rest of Congress can back to work-such as helping @RealDonaldTrump deal with #coronavirus crisis. Impeachment abuse is placing Constitution and the public health at risk! #StoptheCoup. @LouDobbs,,,
2020-02-06T04:11:42Z,FALSE,1114,346,1460,"In one of Wuhans makeshift hospitals, a #coronavirus patient is photographed reading Francis Fukuyamas The Origins of Political Order.",,,
2020-01-31T16:29:25Z,FALSE,1149,308,1457,"As the #coronavirus is intentionally brought into UK, the buses with their totally hazmat suited medics patients move along the road, the bus driver wants to call his union rep whilst he considers how his life came to this.",,,
2020-01-25T10:25:09Z,FALSE,753,700,1453,"All respects for doctors, nurses, pharmacists and medical staffs all around the world who's treating patient infected #coronavirus Please share this to your family, the virus transmission is not a joke, there is still no vaccine, please pray for everyone, and stay safe",,,
2020-02-08T12:49:59Z,TRUE,1086,364,1450,"In China's battle against the novel #coronavirus, women have shown their professionalism, devotion and resilience alongside their male peers. #FightVirus",,,
2020-02-02T16:17:04Z,FALSE,1204,245,1449,"I don't know what's scarier: That the Corona Virus has spread to the Northeast (Boston) or that SO MANY people can't spell, they got #Coronarivus trending. Can we at least get the correct spelling of this dangerous disease to trend instead? #CoronaVirus #coronavirususa",,,
2020-02-06T15:37:15Z,FALSE,844,605,1449,"Tragic - the doctor who warned about #coronavirus and was silenced by police has died from the virus But remarkable that the Global Times, #CCP state media, has reported it",,,
2020-02-08T09:07:25Z,FALSE,869,580,1449,#coronavirus #CoronaVirus this is not a movie,,,
2020-02-08T22:29:30Z,FALSE,769,676,1445,"According to this latest literature review article,the #coronavirus can persist on surfaces (metal, glass, plastic...etc) for up to 9 days. 70% ethanol based disinfectants with 0.5 % hydrogen peroxide are efficient in cleaning surfaces and hands (leave it for 1 min. to evaporate)",,,
2020-02-12T18:05:36Z,TRUE,1018,423,1441,".@SecPompeo on the #coronavirus challenge: President @realDonaldTrump has taken action to try and protect the American people. This is a serious challenge, and the whole world needs to take on this challenge together.",,,
2020-01-29T15:34:37Z,TRUE,773,667,1440,"WHO deeply regrets the error in this week's situation report, which inserted the word moderate inaccurately in the #coronavirus global risk assessment. This was a human error in preparing the report. I have repeatedly stated the high risk of the outbreak",,,
2020-02-06T11:00:42Z,FALSE,867,573,1440,"Footage from US evacuation flight from Remember dont worry, the flu is worse... #coronavirus #coronaviruswuhan #CoronaOutbreak",,,
2020-02-06T22:46:13Z,TRUE,902,537,1439,"Since #coronavirus whistleblower Dr. Li Wenliangs tragic passing, the hashtag #Iwantfreedomofspeech starting trending on Weibo. Many posts directly refer to #Chinas constitution or prominent Chinese writer Lu Xuns quote. Something #Beijing fears the most has been unleashed.",,,
2020-01-29T23:30:13Z,FALSE,1212,226,1438,The #Coronavirus is projected to outsell Liam Payne's LP1 sales within the next 48 hours.,,,
2020-02-10T11:05:42Z,TRUE,986,450,1436,Robots are employed to offer services to people in quarantine amid the #coronavirus fight in China. #FightVirus,,,
2020-01-29T06:35:57Z,TRUE,887,547,1434,"This was the entrance to #Wuhans airport as Americans tried to reach the flight to get them out. Masked police, tankers spraying the road, and eerie silence for an international hub. #China increasingly being cut off from the world to contain the #coronavirus outbreak. @NBCNews",,,
2020-02-10T13:30:25Z,FALSE,785,648,1433,The Shanghai government just announced some terrible news The #Coronavirus IS airborne. It can be spread through the air EVEN if the infected person isn't present Previously many doctors advice was to maintain a 1-2m distance and not wear a mask. This advice is now useless! 1/n,,,
2020-02-06T22:03:53Z,FALSE,772,654,1426,"2/6 #coronavirus A young couple held each other, crying hard and helplessly. They were put into a small closed metal box in a van. The girls crying is heartbreaking. I dont know how they will be treated. But I know this is a very inhumane way of dealing with the infected.",,,
2020-01-25T15:24:10Z,FALSE,929,496,1425,Wuhan today #Wuhan #coronavirus,,,
2020-01-31T11:08:20Z,FALSE,1121,302,1423,"Wife saying goodbye to the doctor before he goes outside with the purpose of serving people in Wuhan city, China. This picture is worth a thousand words #coronavirus #ChinaWuHan",,,
2020-02-04T15:40:25Z,FALSE,837,586,1423,"When the chief of @who praised China for their effort and transparency to help stopping the spread of #coronavirus , while it spread worldwide because of the lack of transparency in China, you know @Who is not an organization you can fully rely on. Art by @ericwychow",,,
2020-02-02T13:16:14Z,FALSE,857,562,1419,"Meanwhile at the airport in Indonesia, arriving passengers are being sprayed with disinfectant from head to to toe due to #coronavirus",,,
2020-01-25T17:05:18Z,FALSE,523,892,1415,[asking] #CoronaVirus #CoronaOutbreak please RETWEET this to spread awareness and dont forget to inform your families friends.,,,
2020-01-29T00:42:33Z,FALSE,872,542,1414,"Latest on the #coronavirus nearly 6000 confirmed cases, 9000 suspected, 132 dead, 103 cured.",,,
2020-01-31T10:19:06Z,FALSE,916,497,1413,An extremely painful video We dont deserve this #coronavirus #CoronavirusOutbreak #PrayForChina #coronaviruswuhan #2019nCoV #China #Wuhan #WuhanCoronavirus #ChinaVirus #WuhanPneumonia #CoronaOutbreak,,,
2020-01-29T05:03:42Z,FALSE,1005,407,1412,No choice but to do this to China #coronavirus,,,
2020-01-29T16:47:06Z,FALSE,860,549,1409,NOT ANYMORE after Emperor Shithole's Chernobyl. #coronavirus has wakened many inside. It reminds the world thatCCP coverup kills more Chinese people. Do freedom loving people want to live under the New Evil Empire's world domination?,,,
